{
  "id": "2-2-literowki",
  "rodzaj": 1,
  "tytul": "Literówki w słowach kluczowych",
  "poziom": 1,
  "czasMin": 3,
  "kolejnosc": 2,
  "kontekst": "Schemat zamówienia przepuszcza wszystko, choć wygląda poprawnie. Autor pisał go z pamięci i pomylił trzy słowa kluczowe. Walidator w magazynie nie zgłosił żadnego błędu, bo nieznane słowa są ignorowane.",
  "polecenie": "Popraw nazwy słów kluczowych, nic więcej. Edytor pokazuje ostrzeżenia z podpowiedzią, o które słowo chodziło. Po poprawce zamówienie bez numeru i zamówienie z numerem jako liczbą mają zostać odrzucone.",
  "slowa": [],
  "podpowiedz": "Zobacz ostrzeżenia pod edytorem: edytor podpowiada najbliższe znane słowo. Poprawne nazwy to `type`, `properties` i `required`.",
  "przyklady": [
    { "opis": "Poprawne zamówienie", "dane": { "numer": "ZAM-2026-000123", "klient": "Jan Nowak" }, "ok": true },
    { "opis": "Bez numeru", "dane": { "klient": "Jan Nowak" }, "ok": false, "wskazowka": "Słowo, które ma wymagać numeru, jest napisane z błędem, więc walidator je pomija." },
    { "opis": "Numer jako liczba", "dane": { "numer": 123, "klient": "Jan Nowak" }, "ok": false, "wskazowka": "Opis pól też ma literówkę. Walidator nie wie, że `numer` ma być tekstem." },
    { "opis": "Lista zamiast obiektu", "dane": ["ZAM-2026-000123"], "ok": false }
  ],
  "bledne": [
    { "plik": "tylko-required", "dlaczego": "Poprawione tylko `required`: zamówienie bez numeru jest odrzucane, ale `propreties` nadal jest ignorowane, więc numer jako liczba przechodzi." }
  ],
  "zrodla": [
    { "twierdzenie": "Nieznane słowa kluczowe są traktowane jak adnotacje i nie wpływają na werdykt.", "zrodlo": "core §4.3.1" }
  ]
}
