{
  "id": "3-4-szprychy",
  "rodzaj": 3,
  "tytul": "Szprychy w opakowaniach zbiorczych",
  "poziom": 2,
  "czasMin": 5,
  "kolejnosc": 4,
  "kontekst": "Szprychy sprzedajemy wyłącznie w opakowaniach po 36 sztuk, od jednego do dziesięciu opakowań na pozycję. Programista zapisał to schematem obok.",
  "polecenie": "Dla każdej ilości obstaw, czy schemat ją przepuści. Potem sprawdź i przeczytaj wyjaśnienia tam, gdzie się pomyliłeś.",
  "slowa": [
    "multipleOf",
    "minimum",
    "maximum",
    "integer"
  ],
  "podpowiedz": "`multipleOf` sprawdza, czy wynik dzielenia jest liczbą całkowitą. `minimum` i `maximum` obejmują granice. `integer` odrzuca liczby z częścią ułamkową.",
  "odpowiedzi": [
    {
      "opis": "Jedno opakowanie",
      "dane": 36,
      "ok": true,
      "wyjasnienie": "36 to dokładnie `minimum`, a granice są włącznie."
    },
    {
      "opis": "Dwa opakowania",
      "dane": 72,
      "ok": true,
      "wyjasnienie": "72 / 36 = 2, wynik całkowity."
    },
    {
      "opis": "Zero sztuk",
      "dane": 0,
      "ok": false,
      "wyjasnienie": "0 jest wielokrotnością 36, ale `minimum` 36 je odrzuca."
    },
    {
      "opis": "Pięćdziesiąt sztuk",
      "dane": 50,
      "ok": false,
      "wyjasnienie": "50 / 36 nie jest liczbą całkowitą."
    },
    {
      "opis": "Dziesięć opakowań",
      "dane": 360,
      "ok": true,
      "wyjasnienie": "360 to dokładnie `maximum`, a granice są włącznie."
    },
    {
      "opis": "Jedenaście opakowań",
      "dane": 396,
      "ok": false,
      "wyjasnienie": "396 jest wielokrotnością 36, ale przekracza `maximum` 360."
    },
    {
      "opis": "Ułamek",
      "dane": 37.5,
      "ok": false,
      "wyjasnienie": "`integer` odrzuca liczby z częścią ułamkową, niezależnie od reszty reguł."
    },
    {
      "opis": "Liczba zapisana jako tekst",
      "dane": "36",
      "ok": false,
      "wyjasnienie": "`\"36\"`{d} to tekst, nie liczba. `type: integer`{s} go odrzuca; bez `type` reguły liczbowe w ogóle nie są sprawdzane dla tekstów."
    }
  ],
  "zrodla": [
    {
      "twierdzenie": "multipleOf: instancja jest poprawna, gdy wynik dzielenia jest liczbą całkowitą.",
      "zrodlo": "validation §6.2.1"
    },
    {
      "twierdzenie": "minimum i maximum obejmują granice.",
      "zrodlo": "validation §6.2.2, §6.2.4"
    },
    {
      "twierdzenie": "Słowa kluczowe dla liczb nie dotyczą instancji innych typów.",
      "zrodlo": "validation §6.2; spec/tests/draft2020-12/multipleOf.json"
    }
  ]
}
