{
  "id": "6-1-faktura-wymaga-nip",
  "rodzaj": 1,
  "tytul": "Faktura wymaga NIP",
  "poziom": 2,
  "czasMin": 6,
  "kolejnosc": 1,
  "kontekst": "Jeśli klient chce fakturę (`faktura: true`), zamówienie musi mieć NIP. Bez faktury NIP jest zbędny. Schemat ma już warunek, ale odrzuca zamówienia prywatne, które w ogóle nie mają pola `faktura`.",
  "polecenie": "Popraw warunek tak, żeby NIP był wymagany tylko wtedy, gdy pole `faktura` jest obecne i równe `true`.",
  "slowa": [
    "if",
    "then",
    "required"
  ],
  "podpowiedz": "`if` z samym `properties` jest spełnione także wtedy, gdy pola nie ma. Dodaj `required: [\"faktura\"]` wewnątrz `if`.",
  "przyklady": [
    {
      "opis": "Faktura z NIP",
      "dane": {
        "numer": "ZAM-2026-000123",
        "faktura": true,
        "nip": "5213017228"
      },
      "ok": true
    },
    {
      "opis": "Faktura bez NIP",
      "dane": {
        "numer": "ZAM-2026-000124",
        "faktura": true
      },
      "ok": false
    },
    {
      "opis": "Bez faktury, bez NIP",
      "dane": {
        "numer": "ZAM-2026-000125",
        "faktura": false
      },
      "ok": true
    },
    {
      "opis": "Zamówienie prywatne bez pola faktura",
      "dane": {
        "numer": "ZAM-2026-000126"
      },
      "ok": true,
      "wskazowka": "Dokument bez `faktura` spełnia `if`, bo `properties` nie wymaga obecności pola. Wymuś obecność wewnątrz `if`."
    },
    {
      "opis": "NIP bez faktury",
      "dane": {
        "numer": "ZAM-2026-000127",
        "faktura": false,
        "nip": "5213017228"
      },
      "ok": true
    }
  ],
  "bledne": [
    {
      "plik": "if-bez-required",
      "dlaczego": "`if` bez `required` jest spełnione dla dokumentu bez pola `faktura`, więc `then` wymaga NIP-u od zamówień prywatnych."
    }
  ],
  "zrodla": [
    {
      "twierdzenie": "then stosuje się, gdy if jest spełnione; properties nie wymaga obecności pola, więc if bez required jest spełnione przy braku pola.",
      "zrodlo": "core §10.2.2.1, §10.3.2.1; spec/tests/draft2020-12/properties.json"
    }
  ]
}