{
  "id": "2-1-pusty-schemat",
  "rodzaj": 3,
  "tytul": "Pusty schemat",
  "poziom": 1,
  "czasMin": 2,
  "kolejnosc": 1,
  "kontekst": "Ktoś w zespole magazynu „na razie” wgrał pusty schemat zamówienia, żeby integracja ruszyła. Obok sześć dokumentów, które przyszły od sklepu.",
  "polecenie": "Dla każdego dokumentu obstaw, czy pusty schemat `{}`{s} go przepuści. Potem sprawdź.",
  "slowa": [],
  "podpowiedz": "Schemat bez żadnej asercji nie ma czego sprawdzać. Zastanów się, czy w `{}`{s} jest jakiekolwiek słowo, które mogłoby coś odrzucić.",
  "odpowiedzi": [
    { "opis": "Kompletne zamówienie", "dane": { "numer": "ZAM-2026-000123", "klient": "Jan Nowak", "pozycje": [{ "ean": "5901234123457", "ilosc": 2 }] }, "ok": true, "wyjasnienie": "Pusty schemat nie ma asercji, więc przechodzi wszystko." },
    { "opis": "Pusty obiekt", "dane": {}, "ok": true, "wyjasnienie": "Nic nie jest wymagane, bo nie ma `required`." },
    { "opis": "Sam `null`", "dane": null, "ok": true, "wyjasnienie": "Nie ma `type`, więc `null` jest tak samo dobry jak obiekt." },
    { "opis": "Pusta lista", "dane": [], "ok": true, "wyjasnienie": "Lista też jest poprawną instancją bez `type`." },
    { "opis": "Tekst", "dane": "cokolwiek", "ok": true, "wyjasnienie": "Tekst przechodzi z tego samego powodu." },
    { "opis": "Liczba", "dane": 42, "ok": true, "wyjasnienie": "Pusty schemat to to samo, co schemat `true`: zawsze przechodzi." }
  ],
  "zrodla": [
    { "twierdzenie": "Pusty schemat {} jest równoważny schematowi true i przepuszcza każdą instancję.", "zrodlo": "core §4.3.2" }
  ]
}
