{
  "id": "7-2-trzy-pliki",
  "rodzaj": 4,
  "tytul": "Zamówienie z trzech plików",
  "poziom": 2,
  "czasMin": 8,
  "kolejnosc": 2,
  "kontekst": "Schemat zamówienia został podzielony na trzy pliki: zamówienie, adres i klient, każdy ze swoim `$id` w przestrzeni `https://kurs.example/schematy/`. Plik główny odwołuje się do dwóch pozostałych względnie. Po ostatniej zmianie walidator nie chce go skompilować.",
  "polecenie": "Znajdź i popraw zepsute odwołanie w pliku głównym, tak żeby wszystkie przykłady dawały oczekiwany werdykt. Diagram po prawej pokazuje, które odwołanie nie prowadzi do żadnego pliku, a panel „jak to widzi walidator” pokazuje identyfikatory plików.",
  "slowa": [
    "$id",
    "$ref"
  ],
  "podpowiedz": "Odwołanie `$ref` musi dokładnie odpowiadać `$id` innego pliku (albo jego końcówce względem wspólnego adresu bazowego). Porównaj literę po literze nazwę w `$ref` z `$id` plików.",
  "glowny": "zamowienie",
  "przyklady": [
    {
      "opis": "Kompletne zamówienie",
      "dane": {
        "numer": "ZAM-2026-000123",
        "klient": {
          "nazwa": "Serwis Rowerowy Pedał",
          "email": "serwis@example.com"
        },
        "adresDostawy": {
          "ulica": "Długa 5",
          "miasto": "Gdańsk",
          "kodPocztowy": "80-827"
        }
      },
      "ok": true
    },
    {
      "opis": "Adres bez miasta",
      "dane": {
        "numer": "ZAM-2026-000124",
        "klient": {
          "nazwa": "Jan Nowak",
          "email": "jan@example.com"
        },
        "adresDostawy": {
          "ulica": "Długa 5",
          "kodPocztowy": "80-827"
        }
      },
      "ok": false
    },
    {
      "opis": "Klient bez e-maila",
      "dane": {
        "numer": "ZAM-2026-000125",
        "klient": {
          "nazwa": "Jan Nowak"
        },
        "adresDostawy": {
          "ulica": "Długa 5",
          "miasto": "Gdańsk",
          "kodPocztowy": "80-827"
        }
      },
      "ok": false
    },
    {
      "opis": "Zły kod pocztowy",
      "dane": {
        "numer": "ZAM-2026-000126",
        "klient": {
          "nazwa": "Jan Nowak",
          "email": "jan@example.com"
        },
        "adresDostawy": {
          "ulica": "Długa 5",
          "miasto": "Gdańsk",
          "kodPocztowy": "80827"
        }
      },
      "ok": false
    }
  ],
  "zrodla": [
    {
      "twierdzenie": "$ref rozwiązuje się względem adresu bazowego ustalonego przez $id.",
      "zrodlo": "core §8.2.1, §8.2.3.1"
    },
    {
      "twierdzenie": "Walidator nie pobiera schematów z sieci; $id to identyfikator.",
      "zrodlo": "core §8.2.1, §8.2.3, §9.1.2"
    }
  ]
}